{
  "$schema": "http://json-schema.org/draft-07/schema#",
  "$id": "https://github.com/andrewstellman/wakecycle/schemas/harness/plan.schema.json",
  "title": "wakecycle plan",
  "description": "Input to `tick.py --init`. One run per entry. dispatch_mode is 'subagent' (in-session, cadence rung 1) or 'shell' (detached host-CLI, cadence rungs 2-4 / the ticker). Top-level knobs default in the tick script if omitted.",
  "type": "object",
  "required": ["entries"],
  "properties": {
    "tick_interval_minutes": {
      "type": "integer",
      "minimum": 1,
      "default": 10,
      "description": "Minutes the orchestrator waits between ticks (ScheduleWakeup cadence) while work is in flight."
    },
    "pool_size": {
      "type": "integer",
      "minimum": 1,
      "default": 3,
      "description": "Max concurrent in-flight runs (claimed/running/stalled). Subscription concurrency caps may force a lower value."
    },
    "stall_threshold_minutes": {
      "type": "integer",
      "minimum": 1,
      "default": 45,
      "description": "A run whose heartbeat mtime is older than this is marked stalled. The mandatory ~3-min worker keepalive keeps a live run well under it."
    },
    "launch_grace_minutes": {
      "type": "integer",
      "minimum": 1,
      "default": 10,
      "description": "A claimed run that emits NO heartbeat within this window is marked auth_or_launch_failed (the dispatch never started a worker)."
    },
    "idle_tick_multiplier": {
      "type": "integer",
      "minimum": 1,
      "default": 1,
      "description": "Lengthens the tick cadence by this factor when nothing is actively running (all waiting/stalled). 1 = uniform cadence."
    },
    "entries": {
      "type": "array",
      "minItems": 1,
      "items": {
        "type": "object",
        "required": ["task_id", "target_repo", "dispatch_mode", "worker_prompt"],
        "properties": {
          "task_id": {
            "type": "string",
            "description": "Stable id for this run, threaded into the heartbeat and result. A2A-ready: a UUID is recommended."
          },
          "target_repo": {
            "type": "string",
            "description": "Absolute path the worker operates on. Council A-2: absolute, never cwd-derived."
          },
          "dispatch_mode": {
            "type": "string",
            "enum": ["subagent", "shell"],
            "description": "v1.5.9: 'subagent' (in-session agent Task/Agent tool, cadence rung 1 only) or 'shell' (detached host-CLI subprocess; REQUIRED for cadence rungs 2-4 / the ticker). schema_version stays '1' — 'shell' is an additive enum value."
          },
          "worker_prompt": {
            "type": "string",
            "description": "The worker prompt. MUST contain the {HEARTBEAT_PATH}/{TASK_ID}/{RUN_DIR}/{TARGET_REPO} placeholders (plus {HARNESS_BIN} for the helper/demo-worker location) the tick engine substitutes with absolute paths at dispatch time (Council A-2 / FR-21a — no model-transcribed paths). subagent mode: passed verbatim to the subagent. shell mode: written to queue/job-NNNNN.prompt.txt (quoting/arg-length safety) and referenced by worker_cmd via {PROMPT_FILE}."
          },
          "heartbeat_path": {
            "type": "string",
            "description": "FR-20 (optional): an ABSOLUTE path to a heartbeat file the job already writes. When set, the harness watches THIS file instead of assigning the run-dir default {HEARTBEAT_PATH} (and {HEARTBEAT_PATH} resolves to it for the worker) — so a pre-existing tool with its own status-file location needs no change. The run-dir result/manifest layout is unaffected."
          },
          "worker_cmd": {
            "type": "array",
            "items": { "type": "string" },
            "description": "shell mode only: argv template the ticker Popens detached. Tokens may carry the placeholder block PLUS {PROMPT_FILE} (the per-job prompt file). Example: [\"claude\",\"--print\",\"--model\",\"sonnet\",\"--append-system-prompt\",\"$(cat {PROMPT_FILE})\"] or [\"python3\",\"<abs>/harness_demo_worker.py\",\"--heartbeat-path\",\"{HEARTBEAT_PATH}\",\"--task-id\",\"{TASK_ID}\",\"--run-dir\",\"{RUN_DIR}\"]."
          },
          "auth_check": {
            "type": "array",
            "items": { "type": "string" },
            "description": "shell mode only (optional): a cheap argv the ticker runs once before the first shell dispatch to verify the host CLI is present + authenticated (FR-16). A nonzero result marks the entry AUTH_OR_LAUNCH_FAILED with an actionable message instead of silently stalling."
          },
          "adapter": {
            "type": "string",
            "enum": ["wrap", "tail"],
            "description": "FR-41 one-field selector. When set, the engine SYNTHESIZES the shell worker_cmd to invoke heartbeat.py, so the operator declares intent in one place and never hand-wires the helper. 'wrap': run `command` as a child and emit its heartbeat stream (doneness = exit code). 'tail': watch `log_path` a job already writes (doneness precedence: process-exit authoritative; optional success_regex/failure_regex/sentinel_file overlay; default COMPLETED on a clean exit). An adapter entry runs as dispatch_mode 'shell' and does not require worker_prompt/worker_cmd."
          },
          "command": {
            "type": "array",
            "items": { "type": "string" },
            "description": "adapter only: the argv to run. Required for adapter 'wrap'; optional for 'tail' (when wakecycle launches+owns the job that writes log_path)."
          },
          "log_path": {
            "type": "string",
            "description": "adapter 'tail' only (required): the log file the job writes; its most recent line becomes the IN_PROGRESS label."
          },
          "success_regex": {
            "type": "string",
            "description": "adapter 'tail' (optional overlay): a log line matching this maps to COMPLETED."
          },
          "failure_regex": {
            "type": "string",
            "description": "adapter 'tail' (optional overlay): a log line matching this maps to FAILED (failure wins over success on a line)."
          },
          "sentinel_file": {
            "type": "string",
            "description": "adapter 'tail' (optional overlay): this file existing maps to COMPLETED."
          },
          "pid": {
            "type": "integer",
            "description": "adapter 'tail' (optional): watch an external process's exit as the authoritative doneness signal (recorded in the claim lock for the engine's dead-PID backstop)."
          }
        }
      }
    }
  }
}
